{
  "$schema" : "http://json-schema.org/draft-04/schema#",
  "title": "Subfields tag Schema",
  "type": "object",
  "properties": {
    "category": {
      "type": "integer"
    },
    "tag": {
      "type": "string"
    },
    "defaultSubfield": {
      "type": "string"
    },
    "subfields": {
      "type": "array",
      "items": {
        "type": "string"
      }
    },
    "repeatable": {
      "type": "array",
      "items": {
        "type": "string"
      }
    }
  },
  "additionalProperties": false
}