{
    "category": 4,
    "tag": "600",
    "defaultSubfield": "a",
    "subfields": [
        "a",
        "q",
        "b",
        "c",
        "d",
        "e",
        "t",
        "n",
        "p",
        "l",
        "k",
        "f",
        "g",
        "h",
        "s",
        "m",
        "o",
        "r",
        "u",
        "x",
        "y",
        "z",
        "v",
        "0",
        "2",
        "3",
        "4",
        "6",
        "j"
    ],
    "repeatable": [
        "c",
        "e",
        "n",
        "p",
        "k",
        "m",
        "x",
        "y",
        "z",
        "v",
        "0",
        "4",
        "j"
    ]
}
